{
  "submitter": {
    "first_name": "Daveed",
    "last_name": "Benjamin",
    "email": "daveed@bridgit.io"
  },
  "submission": {
    "title": "Default Decentralized Privacy VPN for the Meta-Layer",
    "overview": "This submission proposes the inclusion of a default decentralized privacy VPN as an infrastructural layer within the Meta-Layer framework. By ensuring participants can optionally route their interactions, contributions, and identity resolution processes through a resilient, trust-minimized VPN mesh, the Meta-Layer can enhance privacy, resist surveillance, and uphold autonomy without sacrificing usability or speed. The VPN would be integrated at the protocol layer and distributed across participating nodes, using multiparty relays and onion routing as baseline standards. This creates a privacy-respecting economic incentive model while avoiding centralization of control.",
    "source_link": null,
    "raw_content": "Default Decentralized Privacy VPN for the Meta-Layer\n\nThis submission proposes the inclusion of a default decentralized privacy VPN as an infrastructural layer within the Meta-Layer framework. By ensuring participants can optionally route their interactions, contributions, and identity resolution processes through a resilient, trust-minimized VPN mesh, the Meta-Layer can enhance privacy, resist surveillance, and uphold autonomy without sacrificing usability or speed.\n\nDirectly Addressed Desirable Properties:\n\nDP2 - Participant Agency and Empowerment: Participants retain control over their network footprint and gain optional anonymity without losing functional parity.\n\nDP4 - Data Sovereignty and Privacy: Enabling a native privacy VPN ensures that user data remains local, obfuscated, and untracked by default.\n\nDP7 - Simplicity and Interoperability: This VPN module would be plug-and-play, operable across Meta-Layer protocols without additional configuration.\n\nDP15 - Security and Provenance: A decentralized VPN reduces attack vectors and metadata leaks, improving the baseline security posture of the Meta-Layer.\n\nDP6 - Commerce: The VPN layer may participate in a tokenized economy, enabling monetization of privacy routing services.\n\nDP17 - Financial Sustainability: Incentivizing VPN node operation offers a sustainable privacy infrastructure for the Meta-Layer over time.\n\nClarifications & Extensions:\n\nDP4 – Data Sovereignty and Privacy: Mesh VPN as Privacy Backbone\nClarification: The VPN is not merely a user tool but an infrastructural feature, integrated at the protocol layer and distributed across participating nodes, using multiparty relays and onion routing as baseline standards.\nWhy it matters: Treating privacy as a core service ensures it is not marginalized or made contingent on technical skill, financial access, or third-party dependencies.\n\nDP15 – Security and Provenance: Metadata Obfuscation as Provenance Control\nExtension: The VPN system includes ephemeral routing logs with user-controlled retention policies, enhancing the user's ability to audit their own metadata while denying others blanket access.\nWhy it matters: Provenance must include the right to withhold information about origin paths in sensitive contexts, and this approach aligns that goal with network-layer tooling.\n\nDP7 – Simplicity and Interoperability: BYO-VPN Compatibility Layer\nExtension: In addition to offering a native privacy VPN, the Meta-Layer should define a standard interface allowing participants to integrate external VPNs or anonymity layers without requiring custom configuration or loss of functionality.\nWhy it matters: Many users already trust and rely on their own privacy infrastructure. Ensuring compatibility avoids fragmentation, respects user choice, and maintains protocol-agnostic simplicity.\n\nDP6 – Commerce: Privacy VPN as a Meta-Layer Service Market\nExtension: If the default VPN is not free, the Meta-Layer could enable a microtransaction-based model where users pay per session or bandwidth unit using tokens, with commissions shared between node operators and the Meta-Layer treasury. Alternatively, participants could route through third-party VPNs integrated via the BYO-VPN standard, with opt-in revenue sharing agreements.\nWhy it matters: This creates a privacy-respecting economic incentive model while avoiding centralization of control. It also encourages node participation and maintains user flexibility.\n\nDP17 – Financial Sustainability: Incentivized Privacy Infrastructure\nExtension: Routing traffic through privacy-enhancing relays becomes a revenue-generating role for network participants, sustaining the VPN mesh without relying on external funding or coercive monetization.\nWhy it matters: Embedding optional economic incentives directly into the privacy layer aligns long-term viability with user empowerment and network resilience."
  },
  "directly_addressed_dps": [
    {
      "dp": "DP2 - Participant Agency and Empowerment",
      "summary": "Participants retain control over their network footprint and gain optional anonymity without losing functional parity."
    },
    {
      "dp": "DP4 - Data Sovereignty and Privacy",
      "summary": "Enabling a native privacy VPN ensures that user data remains local, obfuscated, and untracked by default."
    },
    {
      "dp": "DP7 - Simplicity and Interoperability",
      "summary": "This VPN module would be plug-and-play, operable across Meta-Layer protocols without additional configuration."
    },
    {
      "dp": "DP15 - Security and Provenance",
      "summary": "A decentralized VPN reduces attack vectors and metadata leaks, improving the baseline security posture of the Meta-Layer."
    },
    {
      "dp": "DP6 - Commerce",
      "summary": "The VPN layer may participate in a tokenized economy, enabling monetization of privacy routing services."
    },
    {
      "dp": "DP17 - Financial Sustainability",
      "summary": "Incentivizing VPN node operation offers a sustainable privacy infrastructure for the Meta-Layer over time."
    }
  ],
  "clarifications_and_extensions": [
    {
      "dp": "DP4 - Data Sovereignty and Privacy",
      "type": "Clarification",
      "title": "Mesh VPN as Privacy Backbone",
      "extension": "The VPN is not merely a user tool but an infrastructural feature, integrated at the protocol layer and distributed across participating nodes, using multiparty relays and onion routing as baseline standards.",
      "why_it_matters": "Treating privacy as a core service ensures it is not marginalized or made contingent on technical skill, financial access, or third-party dependencies."
    },
    {
      "dp": "DP15 - Security and Provenance",
      "type": "Extension",
      "title": "Metadata Obfuscation as Provenance Control",
      "extension": "The VPN system includes ephemeral routing logs with user-controlled retention policies, enhancing the user's ability to audit their own metadata while denying others blanket access.",
      "why_it_matters": "Provenance must include the right to withhold information about origin paths in sensitive contexts, and this approach aligns that goal with network-layer tooling."
    },
    {
      "dp": "DP7 - Simplicity and Interoperability",
      "type": "Extension",
      "title": "BYO-VPN Compatibility Layer",
      "extension": "In addition to offering a native privacy VPN, the Meta-Layer should define a standard interface allowing participants to integrate external VPNs or anonymity layers without requiring custom configuration or loss of functionality.",
      "why_it_matters": "Many users already trust and rely on their own privacy infrastructure. Ensuring compatibility avoids fragmentation, respects user choice, and maintains protocol-agnostic simplicity."
    },
    {
      "dp": "DP6 - Commerce",
      "type": "Extension",
      "title": "Privacy VPN as a Meta-Layer Service Market",
      "extension": "If the default VPN is not free, the Meta-Layer could enable a microtransaction-based model where users pay per session or bandwidth unit using tokens, with commissions shared between node operators and the Meta-Layer treasury. Alternatively, participants could route through third-party VPNs integrated via the BYO-VPN standard, with opt-in revenue sharing agreements.",
      "why_it_matters": "This creates a privacy-respecting economic incentive model while avoiding centralization of control. It also encourages node participation and maintains user flexibility."
    },
    {
      "dp": "DP17 - Financial Sustainability",
      "type": "Extension",
      "title": "Incentivized Privacy Infrastructure",
      "extension": "Routing traffic through privacy-enhancing relays becomes a revenue-generating role for network participants, sustaining the VPN mesh without relying on external funding or coercive monetization.",
      "why_it_matters": "Embedding optional economic incentives directly into the privacy layer aligns long-term viability with user empowerment and network resilience."
    }
  ],
  "_metadata": {
    "source_file": "45.json",
    "file_number": 45
  }
} 